{
  "asof": "2025-10-25T05:33:31.146241Z",
  "macro": {
    "DXY_wow": null,
    "UST10Y_bp_wow": -0.9999999999999787
  },
  "answer": "\n# Synthèse\n1. Contexte macro limité : légère baisse des taux 10Y (-1 bp hebdo), DXY non fourni. Pas de données sur l'or, les mineurs ou autres indicateurs.\n2. Thèmes dominants : sensibilité de l'or aux taux réels et au dollar, effet de levier des mineurs sur le métal.\n3. Drivers clés manquants : inflation, croissance, données géopolitiques, fondamentaux des mineurs (AISC, production).\n4. Horizon 1w/1m : incertitude élevée sans données complètes ; dépendance des prochains indicateurs macro.\n5. Priorité : surveiller les futures publications (DXY, CPI) pour réévaluer.\n\n# Contexte & Indicateurs\n- **Macro** : UST10Y_bp_wow -1 bp (baisse modeste), DXY_wow non fourni.\n- **Or/miners** : Aucune donnée sur prix, fondamentaux, techniques, ou actualité.\n- **Actualité** : Non fournie (pas d'événements earnings/M&A/géopolitiques).\n\n# Scénarios & Probabilités\n| Scénario   | P (%) |\n|---|---|\n| Base   | 60    |\n| Hawkish   | 20    |\n| Dovish   | 20    |\n\n# Risques clés & Signaux\n- **Risques** : \n  1. Rebond du dollar (si DXY manquant s'apprécie).\n  2. Remontée des taux réels (inflation non mesurée).\n  3. Volatilité géopolitique non capturée.\n- **Signaux à monitorer** : \n  1. Publication du DXY et CPI (inflation).\n  2. Données de production des mineurs.\n  3. News flow sur conflits/réserves centrales.\n\n# Impacts marchés\n- **FX** : USD direction incertaine (DXY non fourni).\n- **Taux** : Légère pression baissière (UST10Y -1 bp), mais tendance fragile.\n- **Commodities** : Or neutre à positif si baisse des taux persiste ; sensibilité aux données manquantes.\n- **Equity secteurs** : Mineurs (levier sur l'or) potentiellement bénéficiaires si or haussier, mais fondamentaux non fournis.\n\n# Actions possibles\n1. Attendre des données macro complètes (DXY, inflation).\n2. Surveiller les indicateurs techniques de l'or (RSI, SMA) une fois disponibles.\n3. Diversifier l'exposition aux mineurs en fonction des AISC futurs.\n\n# Hypothèses & Sources\n- **Hypothèses** : Baisse des taux 10Y reflète un relâchement monétaire modeste ; DXY et inflation sont des drivers critiques non fournis.\n- **Sources** : Données UST10Y fournies ; autres indicateurs et actualités non disponibles dans les inputs.\n\n{\"summary\":[\"Contexte macro limité avec UST10Y -1bp hebdo, DXY manquant\",\"Thèmes: sensibilité or aux taux/dollar, levier miners\",\"Drivers clés manquants (inflation, croissance, géopolitique)\",\"Horizon 1w/1m incertain\",\"Priorité surveillance futures données\"],\"scenarios\":[{\"name\":\"base\",\"p\":60},{\"name\":\"hawkish\",\"p\":20},{\"name\":\"dovish\",\"p\":20}],\"risks\":[\"Rebond USD\",\"Remontée taux réels\",\"Volatilité géopolitique\"],\"impacts\":{\"FX\":[\"USD direction incertaine\"],\"rates\":[\"Légère pression baissière\"],\"commodities\":[\"Or neutre à positif si baisse taux\"],\"equity\":[\"Miners potentiellement bénéficiaires si or haussier\"]},\"actions\":[\"Attendre données macro complètes\",\"Surveiller indicateurs techniques or\",\"Diversifier exposition miners\"],\"confidence\":0.1}",
  "parsed": {
    "summary": [
      "Contexte macro limité avec UST10Y -1bp hebdo, DXY manquant",
      "Thèmes: sensibilité or aux taux/dollar, levier miners",
      "Drivers clés manquants (inflation, croissance, géopolitique)",
      "Horizon 1w/1m incertain",
      "Priorité surveillance futures données"
    ],
    "scenarios": [
      {
        "name": "base",
        "p": 60
      },
      {
        "name": "hawkish",
        "p": 20
      },
      {
        "name": "dovish",
        "p": 20
      }
    ],
    "risks": [
      "Rebond USD",
      "Remontée taux réels",
      "Volatilité géopolitique"
    ],
    "impacts": {
      "FX": [
        "USD direction incertaine"
      ],
      "rates": [
        "Légère pression baissière"
      ],
      "commodities": [
        "Or neutre à positif si baisse taux"
      ],
      "equity": [
        "Miners potentiellement bénéficiaires si or haussier"
      ]
    },
    "actions": [
      "Attendre données macro complètes",
      "Surveiller indicateurs techniques or",
      "Diversifier exposition miners"
    ],
    "confidence": 0.1
  }
}